<?xml version="1.0" encoding="UTF-8"?>
<api-rest-model xmlns:xsi="http://www.w3.org/2001/XMLSchema-instance"
xsi:noNamespaceSchemaLocation="schema.xsd">
  <psm-model>
    <so so-name="LINUX"/>
    <technology tech-name="FASTAPI" version="0.0.0" port="4321"/>
    <project name="TIENDA"/>
  </psm-model>



  <relational-model>
    <table name="CLIENTE">
      <attributes>
        <attribute data-type="INT" name="ID_CLIENTE" PK="true"  FK="true"  NN="true" UQ="false" AI="false"/>
        <attribute data-type="VARCHAR" name="name" PK="false"  FK="false"  NN="true" UQ="false" AI="false"/>
        <attribute data-type="BOOL" name="activate" PK="false"  FK="false"  NN="true" UQ="false" AI="false"/>
      </attributes>

    </table>

    <table name="FACTURA">
      <attributes>
        <attribute data-type="INT" name="ID_FACTURA"  PK="true"  FK="true"  NN="true" UQ="false" AI="false"/>
        <attribute data-type="VARCHAR" name="FECHA" PK="false"  FK="false"  NN="true" UQ="false" AI="false"/>
      </attributes>

      <relations>
        <relation multiplicity="1:n" table="CLIENTE" attribute="ID_CLIENTE"/>
      </relations>
    </table>
  </relational-model>
</api-rest-model>